[
  { "asset_id": "T-sand-ripples", "name": "海底沙纹贴图 + 法线", "kind": "texture", "realism": "pbr", "version": "1.0", "file": null, "source": "程序生成", "license": "CC0", "commercial_ok": true, "real_scale": "约 3 m/张", "depiction": "PBR 贴图", "checked_by": "家长", "status": "采用" },
  { "asset_id": "M-pvc-quadrat", "name": "PVC 样方框", "kind": "object", "realism": "pbr_measured", "version": "1.0", "file": null, "source": "按 1 m × 1 m 实物建模", "license": "CC0", "commercial_ok": true, "real_scale": "1 m × 1 m", "depiction": "写实", "checked_by": "家长", "status": "采用" },
  { "asset_id": "M-survey-tape", "name": "调查卷尺", "kind": "object", "realism": "pbr_measured", "version": "1.0", "file": null, "source": "按实物建模，刻度 0.25 m", "license": "CC0", "commercial_ok": true, "real_scale": "带宽 3 cm", "depiction": "写实", "checked_by": "家长", "status": "采用" },
  { "asset_id": "H-park-daylight", "name": "公园实拍 HDRI 环境光", "kind": "hdri", "realism": "photo", "version": "1.0", "file": null, "source": "Poly Haven（经 npm @pmndrs/assets）", "license": "CC0", "commercial_ok": true, "depiction": "实拍光照", "checked_by": "家长", "status": "采用" },
  { "asset_id": "T-grass", "name": "草地 PBR 贴图", "kind": "texture", "realism": "pbr", "version": "1.0", "file": null, "source": "three.js 示例贴图库", "license": "待核验", "commercial_ok": false, "real_scale": "约 4 m/张", "depiction": "PBR 贴图", "checked_by": "家长", "status": "采用标记", "note": "家用先用，商用前核验或替换" },
  { "asset_id": "T-wood", "name": "木纹 PBR 贴图", "kind": "texture", "realism": "pbr", "version": "1.0", "file": null, "source": "three.js 示例贴图库", "license": "待核验", "commercial_ok": false, "depiction": "PBR 贴图", "checked_by": "家长", "status": "采用标记", "note": "家用先用，商用前核验或替换" },
  { "asset_id": "M-wood-blocks", "name": "实木积木方块与托盘", "kind": "object", "realism": "pbr_measured", "version": "1.0", "file": null, "source": "按 3 cm 实木积木建模", "license": "CC0", "commercial_ok": true, "real_scale": "边长 3 cm", "depiction": "写实", "checked_by": "家长", "status": "采用" },
  { "asset_id": "M-peacock-mantis-shrimp-procedural", "name": "孔雀螳螂虾程序模型", "kind": "organism", "realism": "stylized", "version": "0.1", "file": null, "source": "程序建模", "license": "CC0", "commercial_ok": true, "depiction": "看起来像动画片", "checked_by": "家长", "status": "拒绝", "note": "不满足写实底线 BL14" },
  { "asset_id": "M-peacock-mantis-shrimp", "name": "孔雀螳螂虾写实模型", "kind": "organism", "realism": "scan", "version": "—", "file": null, "source": "待定：标本扫描、商用模型或依据照片 AI 生成", "license": "待定", "commercial_ok": false, "real_scale": "约 16 cm", "depiction": "写实", "checked_by": null, "status": "待采购" }
]
